{
  "schemaVersion": "1.0.0",
  "generatedAt": "2026-04-24T09:47:17.765Z",
  "source": {
    "path": "cv.md",
    "title": "CV -- Pravin Sail",
    "sha256": "61b2dbe5d1d8e2daf3d02e6e84aadc744cbcc3e4333b8bcd939bf5e11f3bfb43",
    "lineCount": 214,
    "lastModified": "2026-04-24T09:47:17.765Z"
  },
  "profile": {
    "name": "Pravin Sail",
    "headline": "Enterprise Transformation & Architecture Lead | Regulated Life Sciences | Integration, Governance, Product Strategy, Digital Operations, and AI-Enabled Workflow Design",
    "location": "Pravin Sail",
    "email": "sail.a.pravin@gmail.com",
    "phone": "+49 171 9282295",
    "linkedin": "linkedin.com/in/pravins-profile",
    "github": "github.com/SillyAllen86"
  },
  "summary": "Enterprise transformation and architecture lead with 13+ years of experience connecting business capabilities, systems, data, and governance across regulated life sciences environments. Strong background in target-state architecture, integration strategy, SAP-connected process design, digital manufacturing and laboratory workflows, regulated product and platform governance, and finance-aware delivery planning. Experienced in bridging business, science, QA, operations, IT, vendors, procurement, finance, and commercial stakeholders to align roadmaps, operating models, investment decisions, and implementation-ready process designs. Current focus includes individualized medicine, sample-to-data-to-manufacturing workflows, LES and automation integration, and enterprise orchestration across site and global landscapes. In parallel, builds AI-enabled knowledge, retrieval, diagramming, transcription, and local-first workflow tools across Swift, TypeScript, Python, and web stacks.",
  "coreAreasOfExpertise": [
    "Enterprise transformation and architecture",
    "Integration strategy and governance",
    "Target-state architecture and roadmaps",
    "SAP-connected process design",
    "Data and platform architecture strategy",
    "Product and portfolio governance",
    "Digital manufacturing and laboratory workflow design",
    "Individualized medicine operating model design",
    "Sample management, histology, genomics, and NGS process design",
    "LES / LIMS / MES / QMS strategy",
    "Automation integration and orchestration",
    "BPMN-based workflow decomposition",
    "Capability mapping and operating model design",
    "Information flows, metadata, and control-point design",
    "Patient-specific workflow traceability design",
    "Cross-enterprise exception handling models",
    "GxP / GAMP 5 / ISO 9001 aligned digital design",
    "Governance, validation, and change control",
    "Vendor and requirements management",
    "Program governance and delivery coordination",
    "Multi-stream planning, dependency, and risk tracking",
    "Executive stakeholder communication",
    "Forecasting, budgeting, and forecast-versus-actual tracking",
    "Business-case and pricing model development",
    "Dashboard, reporting, and KPI-led prioritization",
    "AI strategy and governance",
    "AI-enabled workflow and knowledge systems",
    "Semantic search, retrieval, and knowledge architecture",
    "Diagramming and architecture communication",
    "Local-first and privacy-conscious AI solution design",
    "Native and web product prototyping"
  ],
  "domainsAndSystemsKnowledge": {
    "domains": [
      "individualized medicine",
      "biosample operations",
      "sample management",
      "histology",
      "genomics",
      "NGS",
      "manufacturing",
      "supply chain",
      "order-to-cash",
      "lead-to-order",
      "clinical operations",
      "quality and compliance",
      "regulated SaaS",
      "digital product strategy",
      "shared services and content operations",
      "operational excellence",
      "forecasting and budgeting",
      "AI-assisted knowledge management",
      "document intelligence",
      "workflow and task orchestration",
      "transcription and meeting intelligence."
    ],
    "systems": [
      "Thermo Fisher SampleManager LES",
      "Automata LINQ",
      "LES",
      "LIMS",
      "MES",
      "QMS",
      "CTMS",
      "eTMF",
      "SAP ERP",
      "SAP SD",
      "SAP QM",
      "SAP Plant Maintenance",
      "SAP EWM",
      "SAP TM",
      "SAP BTP",
      "vendor-facing EDI patterns",
      "3PL-linked replenishment flows",
      "API-led integration patterns",
      "service-oriented and microservice-oriented interaction concepts",
      "metadata and information-flow design",
      "SwiftUI",
      "SwiftData",
      "TypeScript",
      "Node.js",
      "React",
      "Next.js",
      "Tailwind CSS",
      "Python",
      "SQLite",
      "PostgreSQL",
      "Docker",
      "Redis",
      "OpenAI API",
      "vector retrieval / RAG",
      "local embeddings",
      "markdown / JSON knowledge pipelines",
      "BPMN XML",
      "draw.io XML."
    ]
  },
  "professionalExperience": [
    {
      "company": "BioNTech SE",
      "title": "Digitalisation Lead, Product Supply of Individualized Medicine",
      "period": "May 2023 - Present",
      "bullets": [
        "Lead digitalisation design for product supply of individualized medicine, defining target-state processes, system interaction models, and integration requirements across sample processing, genomics, manufacturing, quality, and enterprise functions.",
        "Define future-state workflows across tissue, blood, histology, genomics, and manufacturing handoffs for patient-specific mRNA operations, including end-to-end traceability, exception handling, and evidence continuity.",
        "Lead workshop-based decomposition of future-state workflows across sample receipt, blood processing, tissue processing, histology, genomics, and sequencing-related activities.",
        "Develop BPMN-oriented process models and capability views covering execution logic, traceability checkpoints, exception paths, and system responsibilities across laboratory, automation, quality, and enterprise functions.",
        "Shape LES and automation integration approaches for lab workflows covering sample execution, instrument interaction, data capture, rerun logic, QC checkpoints, and traceability needs.",
        "Define integration and orchestration considerations between Thermo Fisher SampleManager LES, Automata LINQ, quality-relevant data capture, and SAP-connected enterprise processes.",
        "Define landscape-level dependencies between global and site-specific SAP requirements across plan-to-produce, plant maintenance, store-to-ship, warehouse, quality-management, and sales-order-related flows to support coherent target-state architecture decisions.",
        "Map how global SAP sales-order requirements and site-level production orchestration should trigger production, LIMS, and MES process flows in individualized medicine settings, including dependencies from capacity signals to executable process orders.",
        "Shape roadmap options for site-specific capabilities that remain governed by global platforms but require local implementation, using API-led and microservice-style service exposure patterns rather than broad platform divergence.",
        "Contribute to integration design for purchasing and replenishment scenarios, including EDI-linked purchase requisition flows, vendor feedback loops, and warehouse-triggered replenishment logic.",
        "Develop stakeholder, system, and capability landscape views to clarify ownership, dependencies, inputs, outputs, and control points across the operating model.",
        "Coordinate matrix-style decision-making across laboratory, manufacturing, quality, automation, site, and enterprise stakeholders to align to-be designs, greenfield requirements, and implementation priorities.",
        "Develop executive-ready architecture and operating model artefacts, including layered system landscapes, stakeholder views, and black-box orchestration diagrams.",
        "Support regulatory-conscious design by embedding GxP expectations into workflow design and integration considerations."
      ],
      "location": "Frankfurt am Main, Germany"
    },
    {
      "company": "Elsevier Life Science Solutions",
      "title": "Digital Compliance & Product Strategy Lead",
      "period": "Apr 2019 - Apr 2023",
      "bullets": [
        "Led digital quality, compliance, product management, and cross-functional delivery initiatives for regulated life sciences SaaS platforms serving pharmaceutical and biotech organizations.",
        "Balanced product strategy with regulatory governance by shaping validated processes, release approaches, roadmap inputs, and product capabilities in regulated environments.",
        "Established GAMP 5-aligned validation approaches to support software integrity, compliant releases, and pharma client onboarding.",
        "Led ISO 9001:2015 internal audit activities and CAPA-oriented improvement practices to strengthen quality management discipline.",
        "Translated regulatory, customer, and operational needs into product requirements, prioritization inputs, and roadmap decisions for regulated SaaS offerings.",
        "Partnered with product, operations, and IT teams to improve governance, information security alignment, release readiness, and delivery effectiveness.",
        "Coached product teams in Lean and Agile ways of working to improve prioritization, delivery clarity, program discipline, and product maturity.",
        "Trained and supported new product managers, contributed to product demos, and aligned SaaS roadmap options with client-fit, revenue considerations, and annual planning priorities.",
        "Evaluated customer satisfaction, user-journey feedback, and product-usage signals to recommend roadmap updates and present budget- and cost-approval needs to governance forums.",